cerl_control_number|title|publication_year|language|publication_place|country|publisher
22005|The adventures of Don Quixote, de la Mancha, and his humorous squire Sancho Panca|1795|English|Coventry|England|pratt smith lesson also champante whitrow cr ward london
76195|Vida y hechos del ingenioso cavallero don Quixote de la Mancha|1673|Spanish|Amberes|NA|casa de geronymo y juanbautista verdussen
144614|VIDA Y HECHOS Del Ingenioso Cavellero DON QUIXOTE DE LA MANCHA. PARTE SEGUNDA|1662|Spanish|Bruselas|NA|de la emprenta de juan mommarte impressor jurado
155672|Vida y hechos del ingenioso cauallero don Quixote de la Mancha|1674|Spanish|Madrid|Spain|por andres garcia de la iglesia acosta de d maria armenteros vendese frente de s felipe
170731|L'ingegnoso cittadino Don Chisciotte della Mancia|1829|Italian|Parma|Italy|pietro fiaccadori
230077|Los trabaios de Persiles y Sigismunda|1617|Spanish|Madrid|Spain|por iuan de la cuesta costa de iuan de villaroel mercader de libros la plateria
230357|Vida y hechos del ingenioso hidalgo D. Quixote de la Mancha.|1764|Spanish|Madrid|Spain|andrés ramirez expensas de d pedro joseph alonso y padilla
292968|La discreta galatea|1618|Spanish|Lisbon|Portugal|por antonio aluarez
294158|El ingenioso hidalgo Don Quixote de la Mancha|1610|Spanish|Milan|Italy|por el heredero de pedromartir locarni y iuan bautista bidello
400310|Histoire de l'admirable Don Quichotte de la Manche|1754|French|Paris|France|nyon
463220|Histoire de l'admirable Don Quixotte de la Manche. Tome premier [-quatrieme] [Texte imprimé|1681|French|Paris|France|chez claude barbin mdclxxxi à leyde par les hackius
472105|Los seis libros de Galatea|1784|Spanish|Madrid|Spain|por don antonio de sancha año de mdcclxxxiv se hallará su libreriá la aduana vieja
564790|Les nouvelles. [Texte imprimé], Tome premier|1678|French|Paris|France|c barbin
680722|El ingenioso hidalgo don Quixote de la Mancha. Compuesto por Miguel de Cervantes Saavedra .|1607|Undetermined|Brusselas|NA|por roger velpius inpressor de sus altezas l'aguila de oro cerca de palacio
700166|Oeuvres Complètes De M. De Florian|1800|French|Leipzig|Germany|fleischer
703097|Histoire de l'admirable Don Quichotte de la Manche|1754|French|Paris|France|nyon
796602|Histoire De L'Admirable Don Quixotte De La Manche|1692|French|Amterdam|NA|wolfgang
837182|Novelas ejemplares de Miguel de Cervantes Saavedra ... Tomo 1. -2.!|1821|Spanish|Madrid|Spain|por d miguel de burgos
903159|Vida y hechos del ingenioso cavallero Don Quixote dela Mancha|1697|Spanish|Amberes|NA|^drucker ^henrico ^y ^cornelio verdussen
920828|O engenhoso fidalgo Dom Quixote de la Mancha.|1794|Portuguese|Lisbon|Portugal|na typografia bollandiana
1015414|El Ingenioso Hidalgo D. Quijote de la Mancha|1819|Spanish|Madrid|Spain|la imprenta real
1091543|Werke von Miguel de Cervantes Saavedra|1825|German|Zwickau|NA|schumann
1107131|The history of the renowned Don Quixote de la Mancha|1771|English|Glasgow|Scotland|robert andrew foulis
1108946|Histoire de l'admirable Don Quichotte de La Manche|1741|French|Paris|France|chez bordelet
1109953|Novelas Exemplares.|1816|Spanish|Perpiñán|NA|la de alzina
1114260|Des beruhmten Ritters Don Quixote von Mancha lüstige und sinnreiche Geschichte, Erster Theil|1753|German|Leipzig|Germany|NA
1124245|Viaje al Parnaso.|1784|Spanish|Madrid|Spain|d antonio sancha
1185868|Histoire de l'admirabile Don Quichotte de La Manche|1782|French|Liège|Belgium|bassompierre
1201525|Don Quixote von Mancha, abentheurliche Geschichte|1683|German|Basel|Switzerland|dufour
1201531|Histoire de l'admirable Don Quixotte de la Manche|1696|French|Amsterdam|Netherlands|mortier
1204877|Lehrreiche Erzählungen|1801|German|Königsberg|NA|nicolovius
1324966|Les principales Aventures de l'admirable Don Quichotte|1774|French|Lahaye|NA|bleuet
1335916|The History And Adventures Of The Renowned Don Quixote|1810|English|London|England|brimmercooke
1336383|Histoire De L'Admirable Don Quichotte De La Manche|1750|French|Frankfurt|Germany|bassompierre
1384133|Leben und Thaten des scharfsinnigen Edlen Don Quixote von la Mancha|1818|German|Vienna|Austria|grund
1408227|De voornaamste gevallen van den wonderlyken Don Quichot|1746|Dutch;Spanish|The Hague|Netherlands|pieter de hondt
1453964|Leben und Thaten des weisen Junkers Don Quixote von Mancha|1798|German|Vienna|Austria|haas
1457425|Leben und Thaten des weisen Junkers Don Quixote von Mancha|1778|German|Karlsruhe|Germany|schmieder
1463219|L'histoire de l'ingenievx et redovtable Chevalier, Don Qvixote de la Manche|1646|NA|Roven|NA|chez clement malassis
1477269|Histoire de l'admirable Don Quichotte de la Manche|1741|French|Paris|France|le clerc
1497326|Vida y hechos del ingenioso cavallero Don Quixote de la Mancha|1697|Spanish|Amberes|NA|drucker juan bautista verdussen
1522073|De oude en rechte Don Quichot de la Mancha of de verstandige en vrome Ridder van de Leeuwen|1732|Dutch|Amsterdam|Netherlands|preter visser boekverkovper op de lely gragt
1527435|El Ingenioso Hidalgo Don Quixote De La Mancha|1780|Spanish|Madrid|Spain|ibarra
1571055|Dell' Ingegnoso Cittadino Don Chisciotte Della Mancia|1722|Italian|Venice|Italy|groppo
1571062|Dell' Ingegnoso Cittadino Don Chisciotte Della Mancia|1722|Italian|Venice|Italy|groppo
1587265|Histoire de l'admirable Don Quichotte de la Manche|1741|NA|Paris|France|clousier ua
1601207|Oeuvres Diverses De Michel De Cervantes Saavedra|1768|Undetermined|Amsterdam|Netherlands|arkstée merkus
1608197|The Spanish lady of England|1729|English|London|England|NA
1643262|Leben und Thaten des weisen Junkers Don Quixote von Mancha|1777|German|Weimar|Germany|fritsch
1652982|Histoire de l'admirable Don Quichotte de la Manche / Miguel de Cervantes Saavedra|1679|Undetermined|Paris|France|NA
1700004|Cervantes Sämmtliche Werke|1825|German|Quedlinburg|Germany|basse
1727600|Histoire de l'admirable Don Quixotte de la Manche|1699|French|Amsterdam|Netherlands|mortier
1735407|Histoire de l'amirable Don Quzichotte de la Manche|1735|French|Amsterdam|Netherlands|humbert
1739044|Lehrreiche Erzählungen|1801|German|Königsberg|NA|nicolovius
1745114|Leben und Thaten des weisen Junkers Don Quixote von Mancha|1798|German|Vienna|Austria|haas
1819913|Don Quichotte de la Manche|1802|French|Paris|France|de guilleminet
1819914|Histoire de l'admirable Don Quichotte de la Manche|1824|French|Paris|France|delongchamps livraire
1879477|Histoire de l'admirable Don Quichotte de la Manche|1757|French|Frankfurt|Germany|bassompierre
1879614|Vita ed azioni dell'ingegnoso cittadino D. Chisciotte della Mancia|1816|NA|Milan|Italy|presso pietro agnelli s margarita
1879942|Los inamorados ó Galatea y sus bodas: historia pastoral commenzada; Abreviada despues, y continuada y ultimamente concluida por D. Candido Maria Trigueros|1718|NA|Madrid|Spain|la imprenta real
1880032|El ingenioso hidalgo Don Quixote de la Mancha|1617|NA|Barcelona|Spain|NA
1880077|El ingenioso hidalgo Don Quixote de la Mancha|1787|NA|Madrid|Spain|por d gabriel de sancha
1880286|The history Of the renown'd Don Quixote De la Mancha|1700|NA|London|England|sam buckley
1880302|The life and exploits of Don Quixote de la Mancha|1828|NA|London|England|jones co
1880364|Histoire de l'admirable Don Quichotte de la Manche|1741|NA|Paris|France|le clerc
1882593|Don Quixote von Mancha, abentheurliche Geschichte|1682|NA|Basel|Switzerland|NA
1891976|Lehrreiche Erzählungen|1801|German|Königsberg|NA|nicolovius
1894953|El ingenioso hidalgo Don Quixote de la Mancha comp. por Mig. de Cervantes Saavedra|1782|Spanish|Madrid|Spain|ibarra
1903765|Obras escogidas|1826|NA|Paris|France|NA
1914501|History and adventures of the renowned Don Quixote|1811|English|Philadelphia Pa|USA|birch small
1933735|Die Drangsale des Persiles und der Sigismunda|1808|German|Berlin|Germany|verl realschulbuchhandlung
1934015|El ingenioso hidalgo Don Quixote de la Mancha|1818|Spanish|Leipsique|NA|sommer
1949492|El ingenioso hidalgo don Quixote de la Mancha|1780|Spanish|Madrid|Spain|por don joaquin ibarra
1952384|The history and adventures of the renowned Don Quixote|1799|English|London|England|c cooke
1958878|The history and adventures of the renowned Don Quixote|1799|English|London|England|c cooke
2024057|Exemplarre novells|1640|English|London|England|dawson rm
2025962|Don Quichotte De La Manche|1799|French|Paris|France|detervilledidot
2029357|La Galatea, dividida en seis libros: Compuesta por Miguel de Cervantes Saavedra. Va añadida el viage del Parnasso del mismo autor|1736|Spanish|Madrid|Spain|zuñiga
2074439|Primera parte de la Galatea|1617|Spanish|Valladolid|NA|por francisco fernandez de cordoua costa de geronymo martinez
2139629|The History And Adventures Of The Renowned Don Quixote|1770|English|London|England|straman ua
2185566|Persile Et Sigismonde|1738|French|Paris|France|gandouin
2186279|Vida y hechos del ingenioso caballero Don Quijote de la Mancha|1782|Spanish|Madrid|Spain|martin
2223357|Histoire de Don Quichotte de la Manche|1826|French|Paris|France|sautelet
2247764|Vita, ed azioni dell'ingegnoso cittadino D. Chisciotte della Mancia di Miguel Cervantes Saavedra. Tradotta dallo spagnolo in italiano da Lorenzo Franciosini fiorentino|1816|Italian|Milan|Italy|presso pietro agnelli
2255991|Don Quichotte de la Manche, traduit de l'espagnol de Michel Cervantes par Florian; ouvrage posthume. Orne de 24 figures. Tome premier [-sixieme|1798|French|Paris|France|de l'imprimerie de p didot l'aine chez deterville libraire rue du battoir n
2321981|Vida y hechos del ingenioso caballero Don Quixote de la Mancha|1804|Spanish|Madrid|Spain|vega
2468525|Histoire De L'Admirable Don Quixotte De La Manche|1681|French|Leiden|Netherlands|jacobus hackius
2469459|Obras escogidas de Miguel de Cervantes|1826|Spanish|Paris|France|libreria hispano-francesa de bossange padre
2479041|Leben und Thaten des sinnreichen Junkers Don Quijote von der Mancha|1825|German|Zwickau|NA|schumann
2491173|Historia nova, famosa, e exemplar da Hespanhola ingleza|1748|Portuguese|Lisbon|Portugal|pedro ferreira
2501539|Dell'ingegnoso cittadino Don Chisciotte della Mancia|1625|Italian|Venice|Italy|appresso andrea baba
2528070|El ingenioso hidalgo Don Quijote de la Mancha|1827|Spanish|Paris|France|librería de cormon y blanc
2572497|Ludwig Tieck's Sammtliche Werke. Erster [-dreyssigster] Band|1818|German|Vienna|Austria|und im verlage bey leopold grund
2640627|Histoire de l'admirable Don Quichotte de la Manche [Texte imprimé|1750|French|Frankfurt|Germany|foire je bassompierre
2652520|Histoire de l'admirable Don Quichotte de la Manche|1781|NA|Lyon|France|le roy
2652521|Don Quichotte de la Manche|1809|NA|Paris|France|nicolle
2830104|Leben und Thaten des scharssinniyen Eolen Don Quixote von la mancha|1800|German|Berlin|Germany|NA
2923208|Le mari trop curieux|1809|French|Paris|France|l-p dubray etc
2923224|Des berühunten Gritters Don Quixote von Mancha|1753|German|Leipzig|Germany|verlegts gaspar fritschens del wittner
2934738|El ingenioso hidalgo Don Quixote de la Mancha compuesto por Miguel de Cervantes Saavedra. Nueva edicion corregida denuevo, con nuevas notas, con nuevas estampas, con nuevo analisis, y con la vida de el autor nuevamente aumentada por D. Juan Antonio Pellicer... Parte primera. Tomo I [-Parte segunda. Tomo II|1797|Spanish|Madrid por d gabriel de sancha año de mdcclxxxxvii mdcclxxxxviii|NA|NA
2934786|El ingenioso hidalgo Don Quixote de la Mancha compuesto por Miguel de Cervantes Saavedra corregido denuevo, con nuevas notas, con nuevas viñetas, con nuevo analisis, y con la vida de el autor nuevamente aumentada por Don Juan Antonio Pellicer... Parte primera. Tomo I [-Parte segunda. Tomo VIII|1798|Spanish|Madrid por don gabriel de sancha año de mdcclxxxxviii mdcclxxxxix|NA|NA
2964559|El Ingenioso Hidalgo Don Quixote De La Mancha|1801|Spanish|Leipzig|Germany|sommer
2966276|Histoire de l'amirable Don Quzichotte de la Manche|1735|French|Amsterdam|Netherlands|humbert
2997579|El ingenioso hidalgo Don Quixote de la Mancha., Pt. 1., T. 1|1780|Spanish|Madrid|Spain|por don joaquin ibarra
3007692|The history of the most ingenious Knight Don Quixote de la Mancha|1706|English|London|England|NA
3017579|Primera parte de la Galatea|1617|Spanish|Valladolid|NA|por francisco fernandez de cordoua costa de geronymo martinez
3048283|Histoire De L'Admirable Don Quichotte De La Manche|1735|French|Amsterdam|Netherlands|humbert
3048473|Histoire De L'Admirable Don Quichotte De La Manche|1732|French|Paris|France|compagnie des libraires
3048735|Don Quixote De La Mancha|1818|English|London|England|bulmercadell davies
3050572|El Ingenioso Hidalgo Don Quijote De La Mancha|1829|Spanish|Madrid|Spain|ramos
3050642|The Life And Exploits Of Don Quixote De La Mancha|1824|English|London|England|knight laceysears
3052698|Histoire De L'Admirable Don Quichotte De La Manche|1830|French|Paris|France|marlinallois
3056897|El Ingenioso Hidalgo Don Quixote de la Mancha|1814|Spanish|Paris|France|bossange y masson
3090624|El ingenioso Don Quixote|1608|Undetermined|Madrid|Spain|NA
3124404|Segunda parte del ingenioso Cavallero Don Quixote de la Mancha|1615|Spanish|Madrid|Spain|por iuan de la cuesta vendese casa de francisco de robles librero del rey ns
3195070|The life and exploits of the ingenious gentleman Don Quixote de la Mancha|1749|English|London|England|r tonson r dodsley
3240899|El Ingenioso Hidalgo Don Quixote de la Mancha compuesto por Miguel de Cervantes Saavedra. Nueva ed. corr. de nuevo... con nuevo analisis, y con la vida de el autor nuevamente aumentada por D. Juan Antonio Pellicer,..|1797|Spanish|Madrid|Spain|dg de sancha
3240907|Vida y hechos del ingenioso caballero Don Quixote de La Mancha. Compuesta por Miguel de Cervantes Saavedra. Nueva edicion: repartida en quatro tomos... Tomo II..|1808|Spanish|Madrid|Spain|por la viuda de barco lopez
3240925|Novelas exemplares... La Gitanilla. El amante liberal. Rinconete y Cortadillo. La Española Inglesa. El licenciado Vidriera. La fuerça de la sangre. El zeloso estremeño. La illustre Fregona. Las dos Donzellas. La Señora Cornelia. El casamieto engañoso. La de los Perros|1614|Spanish|Brusselas|NA|r velpio y h antonio
3240941|Les Principales avantures de l'admirable Don Quichotte représentées en figures par Coypel, Picart le Romain et autres habiles maitres avec les explications des XXXI planches de cette magnifique collection tirées de l'original espagnol de Miguel de Cervantès|1746|French|La haie|NA|p de hondt
3421131|El Ingenioso hidalgo Don Quixote de la Mancha, compuesto por Miguel de Cervántes Saavedra... [Texte imprimé|1605|Spanish|Valencia|Spain|impresso casa de p p mey costa de ferrer
3421150|Vida y hechos del ingenioso cavallero Don Quixote de la Mancha, compuesta por Miguel de Cervántes Saavedra. Nueva edicion... ilustrada con quarenta y quatro laminas... - Vida de Miguel de Cervántes Saavedra,... autor Don Gregorio Mayáns i Siscár,... 6a impression segun la primera [Texte imprimé|1751|Spanish|Madrid|Spain|p alonso y padilla
3421156|El Ingenioso hidalgo Don Quixote de la Mancha, compuesto por Miguel de Cervántes Saavedra. Nueva edicion... con nuevas notas... con nuevo analisis y con la vida de el autor nuevamente aumentada por D. Juan Antonio Pellicer,... [Texte imprimé|1798|Spanish|Madrid|Spain|de sancha
3421169|Le valeureux Don Quixote de la Manche, ou l'Histoire de ses grands exploicts d'armes, fidèles amours et adventures estranges... Traduit fidèlement de l'espagnol de Michel de Cervantes... par César Oudin,... 3e édition revue et corrigée [Texte imprimé|1620|French|Paris|France|foüet
3421175|Histoire de l'admirable Don Quixotte de la Manche. (Traduit de l'espagnol de Cervantès, par Filleau de Saint-Martin.) [Texte imprimé|1695|French|Amsterdam|Netherlands|p mortier
3421188|Histoire de l'admirable Don Quichotte de la Manche, traduite de l'espagnol de Michel de Cervantès (par Filleau de Saint-Martin). - Continuation de l'histoire de l'admirable Don Quichotte de la Manche... (traduite par G. de Chasles.) [Texte imprimé|1768|French|Paris|France|compagnie des libraires
3421236|Novelas exemplares de Miguel de Cervántes Saavedra... Nueva impresion... [Texte imprimé|1783|Spanish|Madrid|Spain|de sancha
3421246|Les nouvelles de Miguel Cervantès. Traduction nouvelle [Texte imprimé|1678|French|Paris|France|c barbin
3421251|Nouvelles de Michel de Cervantès,... Traduction nouvelle (par l'abbé Saint-Martin de Chassonville)... [Texte imprimé|1723|French|Rouen paris|NA|p witte
3421272|Relatione di quanto è successo nella città di Vagliadolid dopo il felicissimo nascimento del principe di Spagna Don Filippo Dominico Vittorio,... Tradotta di lingua castigliana (di Cervantès) da Cesare Parona... [Texte imprimé|1608|Italian|Milan|Italy|bordoni e p m locarni
3567273|Don Quichotte de la Manche|1799|French|Paris|France|deterville
3570650|Leben und Thaten des weisen Junkers Don Quixote von Mancha / Miguel de Cervantes Saavedra. Aus d. Urschr. d. Cervantes... in 6 Bdn. von Friedr. Just. Bertuch|1785|German|Karlsruhe|Germany|schmieder
3600109|The history of the renowned Don Quixote de la Mancha|1749|English|London|England|w imps r ware
3712723|El Ingenioso hidalgo Don Quijote de la Mancha... V [Texte imprimé|1819|Spanish|Madrid|Spain|NA
3719107|Vita ed azioni dell'ingegnoso cittadino D. Chisciotte della Mancia... tradotta dallo spagnuolo in italiano... 6ta edizione... [Texte imprimé|1795|Italian|Venice|Italy|NA
3794435|Leben und Thaten des scharfsinnigen Edlen Don Quixote von la Mancha|1799|German|Berlin|Germany|bey johanna friedrich unger
3804840|The history of the ingenious gentleman Don Quixote of La Mancha|1822|English;Spanish|Edinburgh|Scotland|constable
3889051|El Ingenioso Hidalgo Don Quixote de la Mancha.|1797|Spanish|Madrid|Spain|por d gabriel de sancha
3903528|L'ingegnoso cittadino Don Chisciotte della Mancia|1829|Italian|Parma|Italy|pietro fiaccadori
3903541|Don 'Kischot' la Manxchii|1815|Russian|Moscow|Russia|iniversischoschoi tipografia
3998048|Don Quichotte de la Manche|1798|French|Paris|France|de p didot l'aîné
4037469|Numancia [Texte imprimé|1829|German|Zwickau|NA|NA
4078597|Vida, y hechos del ingenioso cavallero don Quixote de la Mancha. Compuesta por Miguel de Cervantes Saavedra. Parte primera -2.!|1714|Spanish|Madrid|Spain|costa de francisco laso mercader de libros
4141365|Novelas Ejemplares [Texte imprimé|1825|Spanish|Paris|France|libr de cormón y blanc
4160572|Vida Y Hechos Del Ingenioso Hidalgo Don Quixote De La Mancha|1738|Spanish|London|England|tonson
4160580|Vida Y Hechos Del Ingenioso Hidalgo Don Quixote De La Mancha|1738|Spanish|London|England|tonson
4162610|The Life And Exploits Of Don Quixote De la Mancha|1821|English|Liverpool london|NA|reillybumpussammssharpewarrenwilson
4197229|Histoire de l'admirable Don Quichotte de la Manche|1825|French|Paris|France|delongchamps libraire-éditeur
4253828|The entertaining history of that famous knight, Don Quixote de la Mancha|1776|English|London|England|h turpin no st john's-street west smithfield s bladon no bew no pater-noster-row
4258383|The life and exploits of the ingenious gentleman Don Quixote de la Mancha|1825|English|New York NY|USA|e duyckinck
4259390|Novelas exemplares de Miguel de Cervantes Saavedra|1799|Spanish|Madrid|Spain|imprenta de villalpando c
4301432|Histoire de l'admirable Don Quichotte de la Manche|1723|French|Lyon|France|th amaulry
4301435|Galatea|1813|English|London|England|s robinson f swan
4302349|El ingenioso Hidalgo Don Quijote de la Mancha|1827|Spanish|Paris|France|imprenta de julio didot mayor
4302350|El ingenioso Hidalgo don Qvixote de la Mancha|1605|Spanish|Con privilegio madrid|NA|por iuan de la cuesta vendese casa de francisco de robles librero del rey nr̃o senor
4352561|Oeuvres de Florian|1802|French|Paris|France|librairie économique
4355556|Oeuvres de Florian|1800|French|Paris|France|detervilleguilleminet
4363012|Histoire de l'admirable Don Quichotte de la Manche|1733|French|Paris|France|cavelier
4476812|Nouelle di Michel di Ceruantes Saauedra, cioe La bella Cinganetta. L'amante liberale ... Nouamente trasportate dalla lingua castigliana nella nostra italiana da Donato Fontana milanese .|1629|Italian|Milan|Italy|per gio battista caneuese al segno della beata vergine
4490500|L'Ingenieux Chevalier Don Quixote de la Mancha nouvelle traduction.|1821|French|París|NA|th descer
4527334|Les Nouvelles de Miguel Cervantes. Traduction nouvelle|1689|French|Paris|France|chez etienne ducastin dans la galerie des prisonniers au bon-pasteur
4671174|Histoire de l'admirable Don Quixotte de la Manche|1704|French|Paris|France|barbin
4693987|Histoire de l'admirable Don Quichotte de La Manche|1793|French|Lyon|France|d'amable leroy
4752877|Novelas Exemplares De Miguèl De Cervantes Saavedra .|1739|Spanish|Haye|NA|neaulme
4787970|The life and exploits of the ingenious gentleman Don Quixote de la Mancha|1788|English|London|England|dodsley
4788435|Trabajos de Persiles y Segismunda|1802|Spanish|Madrid|Spain|sancha
4788440|The history and adventures of the renowued Don Quixote|1796|English|Dublin|Ireland|john chambers
4847802|Vida, Y Hechos Del Ingenioso Cavallero Don Quixote De La Mancha|1741|Spanish|Madrid|Spain|san martin
4849694|El Ingenioso Hidalgo Don Quijote De La Mancha|1825|Spanish|Lyon paris|NA|durand y perrincormon y blanc
4851161|Histoire De L'Admirable Don Quichotte De La Manche|1830|French|Paris|France|marlinallois
4867658|Los Habladores|1646|Spanish|Cadiz|Spain|de velazco
4869894|El Ingenioso Hidalgo Don Quixote De La Mancha|1780|Spanish|Madrid|Spain|ibarra
4883779|Den Verstandigen Vroomen Ridder, Don Quichot de la Mancha|1657|Dutch|Dordrecht|Netherlands|savry
4934923|La Galatea, dividida en seis libros, compuesta por Miguel de Cervantes Saavedra. Va añadido El viage del Parnaso del mismo autor|1772|Spanish|Madrid|Spain|la oficina de viuda de manuel fernandez
4977620|Der sinnreiche Junker Don Quixote von La Mancha|1800|German|Königsberg|NA|nicolovius
4992104|De Voornaamste Gevallen van den Wonderlyken Don Quichot|1746|Dutch|Haye|NA|pieter de hond
5023161|El Ingenioso hidalgo Don Quixote de la Mancha, compuesto por Miguel de Cervántes Saavedra. Nueva edicion corregida por la real Academia española. [- Vida de Cervántes y análisis del Quixote, por Vicente de Los Rios.] [Texte imprimé|1780|Spanish|Madrid ibarra|NA|NA
5023170|Novelas exemplares, de Miguel Cervantès Saavedra. 3e édition.] [Texte imprimé|1614|Spanish|Pamplona por n de assiayn|NA|NA
5023173|Trabajos de Persiles y Sigismunda, historia setentrional, por Miguel de Cervantes Saavedra... [Texte imprimé|1799|Spanish|Madrid f villalpando|NA|NA
5045033|Leben und Thaten des weisen Junkers Don Quijote von Mancha. Vierter Theil|1798|German|Vienna|Austria|bey franz haas
5169974|Comedias, Y Entremeses De Miguel De Cervantes Saavedra, El Autor Del Don Quixote|1749|Spanish|Madrid|Spain|marin
5173871|Don Quichotte de la Manche|1830|French|Paris|France|NA
5177387|Der sinnreiche Junker Don Quixote von La Mancha|1800|German|Königsberg|NA|nicolovius
5211048|El Ingenioso hidalgo Don Quixote de la Mancha, compuesto por Miguel de Cervantes Saavedra... [Texte imprimé|1804|Spanish|Burdeos|NA|de pinard año xii-
5290310|El Curioso impertinente|1608|Undetermined|Paris|France|richez
5322832|Los trabaios de Persiles, y Sigismunda, historia setentrional|1617|Spanish|Barcelona|Spain|sorita
5470612|Los trabaios de Persiles y Sigismunda|1617|Spanish|Madrid|Spain|por iuan de la cuesta costa de iuan de villaroel
5470819|The history and adventures of the renowned Don Quixote de la Mancha|1794|English|London|England|alex hogg
5575499|The history and adventures of the renowned Don Quixote|1765|English|London|England|osborne others
5632189|El ingenioso hidalgo Don Quixote de la Mancha|1797|Panjabi|Madrid|Spain|por d gabriel de sancha
5634085|El ingenioso hidalgo Don Quixote de la Mancha|1610|Panjabi|Milan|Italy|por el heredero de pedromartir locarni y iuan bautista bidello
5634591|Don Quichotte de la Manche|1809|re;French|Paris|France|de l'imprimerie de didot l'aînéet chez didier tebbett
5635152|The history of the valorous and vvitty-knight-errant, Don-Quixote, of the Mancha|1652|Undetermined;English|London|England|r hodgkinsonne andrew crooke
5651408|Leben und Thaten des scharfsinnigen Edlen Don Quixote von la Mancha|1816|German|Berlin|Germany|realschulbuchhandlung
5651410|Novelas exemplares de Miguèl de Cervantes Saavedra|1797|NA|Valencia|Spain|NA
5768605|Viage del Parnaso|1624|Spanish|Milan|Italy|por iuā bautista bidelo
5797687|Persilus und Sigismunda, nordische Historie|1746|German|Ludwigsburg ludwigsburg|NA|pfotenhauer
5830646|L'ingegnoso cittadino Don Chisciotte della Mancia [Texte imprimé|1830|Italian|Parma|Italy|p fiaccadori
5837257|Nouvelles espagnoles ... Le sot curieux. Nouvelle sixième. [Traduit par M Lefebur de Villebrun|1717|French|Paris|France|NA
5885646|El Ingenioso Hidalgo Don Quixote De La Mancha|1780|Spanish|Madrid|Spain|ibarra
5890079|El ingenioso hidalgo Don Quijote de la Mancha : Vida y hechos del ingenioso hidalgo Don Quixote de la Mancha / Miguel de Cervantes Saavedra|1780|Spanish|Madrid|Spain|ibarra
5938068|Don Quichotte de la Manche|1799|French|Paris|France|deterville
5944068|The much esteemed history of the ever-famous knight, Don Quixote de la Mancha|1806|English|Gainsborough|England|h mozley
5982290|L'ingegnoso cittadino Don Chisciotte della Mancia|1622|Italian|Venice|Italy|appresso andrea baba
