cerl_control_number|title|publication_year|language|publication_place|country|publisher
3632345|Le Givre de Richebourg. Persile et Sigismonde. Histoire septentrionale tirée de l'espagnol de Michel de Cervantès Tome 4 [par Miguel de Cervantès Saavedra|1740|French|Amsterdam|Netherlands|changuion
3632347|Don Quichotte de La Manche traduit de l'espagnol [par Bernard Florian|1802|French|Paris|France|guilleminet
3633529|Comedia de la Soberana-Virgen de Guadalupe, y sus milagros, y grandezas de España|1617|Spanish|Sevilla|NA|b gómez de pastrana
3634141|Obras escogidas de...., Tomo noveno, Teatro|1829|Spanish|Madrid|Spain|de los hijos de doña catalina piñuela
3634142|Obras escogidas...., ( T. X, Teatro|1826|Spanish|Paris|France|de bossange
3634143|Novelas ejemplares de Miguel de Cervantes Saavedra., T. I-II|1825|Spanish|Paris|France|lib de cormon y blanc
3634214|Don Quichotte de la Manche|1812|French|Paris|France|aa renouard
3634560|Historia de los trabajos de Persiles y Sigismunda, escrita por Miguel de Cervantes Saavedra, nuevamente corregida..|1760|Spanish|Barcelona|Spain|nadal
3634561|Los Seis libros de Galatea, escrita por Miguel de Cervántes Saavedra... corregida é ilustrada..|1784|Spanish|Madrid|Spain|de sancha
3647677|Des berühmten Ritters Don Quixote von Mancha Lustige und sinnreiche Geschichte|1753|German|Leipzig|Germany|fritsch
3647679|Des berühmten Ritters Don Quixote von Mancha Lustige und sinnreiche Geschichte|1753|German|Leipzig|Germany|fritsch
3675864|Vida y hechos del ingenioso hidalgo don Quixote de la Mancha. Compuesta por Miguel de Cervantes Saavedra en quatro tomos. Parte primera -segunda!. Tomo primero [-quarto|1738|Spanish|London|England|por y r tonson
3691663|Der spanische Waghals|1696|NA|Nürnberg|Germany|NA
3712723|El Ingenioso hidalgo Don Quijote de la Mancha... V [Texte imprimé|1819|Spanish|Madrid|Spain|NA
3719107|Vita ed azioni dell'ingegnoso cittadino D. Chisciotte della Mancia... tradotta dallo spagnuolo in italiano... 6ta edizione... [Texte imprimé|1795|Italian|Venice|Italy|NA
3736797|Trabajos de persiles y sigismunda|1781|Spanish|Madrid|Spain|imprenta de sancha
3736846|Oeuvres choisies|1807|French|Paris|France|des sciences des arts
3781424|The History of the renowned Don Quixote de la Mancha. Written in Spanish by Miguel de Cervantes Saavedra. Translated by several hands: and published by the late mr. Motteux. Adorn'd with new sculptures. Vol. 1. -4.!|1749|English|London|England|w innys r ware s birt etc!
3783564|Der sinnreiche Junker Don Quixote von la Mancha von Miguel Cervantes de Saavedra. Aus dem Spanischen übersetzt durch Dietrich Wilhelm Soltau|1826|German|Vienna|Austria|und verlegt bey chr fr schade
3783673|El Ingenioso Hidalgo Don Quijote de la Mancha compuesto por Miguel Cervantes de Saavedra. Tomo 1. (-4.|1825|Spanish|Paris|France|libreria de cormon y blanc
3786214|The liberal lover|1729|English|London|England|NA
3794416|Teatro.|1829|Spanish|Madrid|Spain|por los hijos de da catalina piñuela
3794418|Vida, y hechos del ingenioso hidalgo Don Quixote de la Mancha.|1750|Spanish|Madrid|Spain|juan de san martin
3794419|Vida y hechos del ingenioso caballero Don Quixote de la Mancha.|1777|Spanish|Madrid|Spain|manuel martín
3794420|Vida y hechos del ingenioso caballero Don Quixote de la Mancha.|1777|Spanish|Madrid|Spain|de d antonio de sancha
3794421|Vida y hechos del ingenioso caballero Don Quixote de la Mancha|1808|Spanish|Madrid|Spain|por la viuda de barco lópez
3794422|Histoiré de l'Admirable Don Quichotte de la Manche|1722|French|Paris|France|compagnie de libraires
3794423|Histoire de l'admirable Don Quichotte de la Manche.|1735|French|Amsterdam|Netherlands|pierre humbert
3794425|The life and exploits of Don Quixote de la Mancha|1828|English|Ereter|NA|b williams
3794435|Leben und Thaten des scharfsinnigen Edlen Don Quixote von la Mancha|1799|German|Berlin|Germany|bey johanna friedrich unger
3795850|The history of the most renowned Don Quixote of Mancha|1687|English|London|England|thomas hodgkin william whitwood golden dragon west-smithfield next crown tavern
3795979|L'histoire de l'ingénieux et redoutable cheualier, dom-Quichot de la Manche|1625|French|Paris|France|chez iean mestais imprimeur librairie demeurant à la porte sainct victor
3798873|Vida y Hechos del ingenioso Cavallero Don Quixote de la Mancha|1672|Spanish|Amberes|NA|NA
3798874|L'ingegnoso cittadino Don Chisciotte della Mancia|1677|Italian|Rome|Italy|NA
3798875|Los trabaios de Persiles y Sigismunda : Historia setentrional|1629|Spanish|Pamplona|NA|NA
3804450|The adventures of Don Quixote, de la Mancha, knight of the sorrowful countenance, and his humourous squire, Sancho Pancha|1821|English|New York NY|USA|solomon king wholesale retail his book store broadway
3804840|The history of the ingenious gentleman Don Quixote of La Mancha|1822|English;Spanish|Edinburgh|Scotland|constable
3828883|El ingenioso hidalgo Don Quijote de la Mancha [Texte imprimé|1825|Spanish|Paris|France|librería de cormon y blanc
3841554|Novelas exemplares de Miguel de Cervantes Saavedra. Nueva impresion, corregida y adonada con laminas|1816|Spanish|Perpiñan|NA|la imprenta de alzine
3841780|Numance [Texte imprimé|1829|French|Paris|France|dufey
3842217|Novelas exemplares de Miguel de Cervantes Saavedra. Dirigidas a don Pedro Fernandez de Castro conde de Lemos. Nueva impresion corregida y adornada con laminas. Tomo I[-II|1783|Spanish|Madrid|Spain|por don antonio de sancha
3865476|Los trabaios de Persiles, y Sigismunda, historia setentrional. Por Miguel de Ceruantes Saauedra. Dirigido a don Pedro Fernandez de Castro .|1617|Spanish|Valencia|Spain|por pedro patricio mey junto san martin
3872761|Vita, ed azioni dell'ingegnoso cittadino D. Chisciotte della Mancia di Michel di Cervantes Saavedra; tradotta dallo spagnuolo in italiano da Lorenzo Franciosini fiorentino ... Tomo 1. [-segue il tomo 2.|1795|Italian|Venice|Italy|presso sebastiano valli
3876242|Dell'ingegnoso cittadino Don Chisciotte della Mancia. Composta da Michel di Ceruantes Saauedra. Et hora nuouamente tradotta con fedeltà , e chiarezza, di spagnuolo in italiano, da Lorenzo Franciosini fiorentino. Parte prima [- seconda]. .|1625|Italian|Venice|Italy|appresso andrea baba
3878600|Histoire de l'admirable don Quichotte de la Manche|1738|French|Lyon|France|chez rigollet
3887389|De oude en rechte Don Quichot de La Mancha, of De verstandige en vrome ridder van de leeuwen|1732|Dutch|Amsterdam|Netherlands|p visser bsr
3888814|El ingenioso hidalgo don Quixote de la Mancha|1610|Spanish|Milan|Italy|por el heredero de pedromartir locarni y iuan bautista bidello
3888815|Vida y hechos del ingenioso cavallero don Quixote de la Mancha|1671|Spanish|Bruselas|NA|costa de pedro de la calle
3888941|Novelas exemplares|1703|Spanish|NA|NA|NA
3889050|Vida y hechos del ingenioso hidalgo don Quixote de la Mancha.|1755|Spanish|Amsterdam|Netherlands|arkstée y merkus
3889051|El Ingenioso Hidalgo Don Quixote de la Mancha.|1797|Spanish|Madrid|Spain|por d gabriel de sancha
3889052|El Ingenioso hidalgo Don Quijote de la Mancha|1827|Spanish|Paris|France|librería de cormou y blanc
3889053|Histoire de l'admirable Don Quichotte de la Manche.|1750|French|Frankfurt|Germany|jean françois bassompierre
3889054|Don Quichotte de la Manche|1812|French|Paris|France|chez ant aug renouard
3889055|Life and adventures of Don Quixote de la Mancha|1820|English|London|England|hurts robinson co
3889058|Vida, y hechos del ingenioso caballero D. Quixote de la Mancha.|1764|Spanish|Madrid|Spain|de andres ramirez
3890395|Seconde partie de l'histoire de l'ingenieux et redoutable cheualier, don Quichot de la Manche|1618|French|Paris|France|chez la vesue iacques du clou denis moreau ruë s iacques à la salemandre
3890396|The second part of the history of the valorous and witty knight-errant, Don Quixote of the Mançha|1620|English|London|England|edward blount
3890438|Den verstandigen vroomen ridder Don Quichot de la Mancha|1669|Dutch|Amsterdam|Netherlands|baltes boeckholt boeckverkooper in't midden van de niesel
3893313|El ingenioso Hidalgo Don Quixote de la Mancha|1607|Spanish|Brusselas|NA|NA
3893314|Leben und Thaten der weisen Junkers Don Quixote von Mancha : neue Ausgabe aus der Urschrift nebst der Fortsetzung der Avellaneda, in 6 Bänden|1775|German|Weimar leipzig|NA|NA
3900496|Historia del famoso cavallero, Don Quixote de la Mancha|1781|Spanish|London|England|se hallarán las librerias de b white p elmsley y payne y robinson
3900625|The history of the valorous and witty knight-errant, Don Quixote of the Mancha|1740|English|London|England|d midwinter w innys r robinson ward r knapton others london
3903283|Vida y hechos del ingenioso cavallero don Quixote de la Mancha|1697|Spanish|Amberes|NA|por henrico y cornelio verdussen
3903526|Vida y hechos del ingenioso caballero don Quixote de la Mancha|1771|Spanish|Madrid|Spain|por d joachin ibarra impresor de cámara de sm costa de la real compañia de impresores y libreros del reyno
3903527|Histoire de l'admirable Don Quichotte de la Manche|1738|French|Lyon|France|chez rigollet
3903528|L'ingegnoso cittadino Don Chisciotte della Mancia|1829|Italian|Parma|Italy|pietro fiaccadori
3903529|The exemplary novels|1822|English|London|England|luke hansard p sons
3903530|The history and adventures of the renowned Don Quixote.|1755|English|London|England|miller etc
3903540|Der sinnreiche Junker Don Quixote von la Mancha|1825|German|Leipzig|Germany|fa brockhaus
3903541|Don 'Kischot' la Manxchii|1815|Russian|Moscow|Russia|iniversischoschoi tipografia
3904018|Delight in severall shapes drawne to the life in six pleasant histories|1654|English|London|England|william sheares bible s pauls church-yard over against little north doore
3904524|The history and adventures of the renowned Don Quixote|1811|English|Philadelphia Pa|USA|birch small small
3928647|Vida y Hechos del ingenioso hidalgo don Quixote de la Mancha compuesta por Miguel de Cervantes Saavedra|1736|Spanish|Leon de francia|NA|bonnardel
3929354|Oeuvres diverses de Michel de Cervantes Saavedra. Traduites de l'espagnol|1768|French|Amsterdam|Netherlands|arkstée
3937836|Pověsti Mihajly Servantesa, avtora Donʺ-Kišota., častʹ III [Texte imprimé|1805|Russian|Moscow|Russia|vʺ volʹnoj universitetskoj tipografìi
3947735|Vida, Y Hechos Del Ingenioso Cavallero D. Quixote De La Mancha|1755|Spanish|Barcelona|Spain|jolis
3965984|Nouelas exemplares de Miguel de Ceruantes Saauedra. Dirigido a don Pedro Fernandez de Castro, conde de Lemos, .|1614|Spanish|Pamplona|NA|por nicolas de assiayn impressor del reyno de nauarra
3976463|Nouelle di Michel di Ceruantes Saauedra, cioè La bella Cinganetta. L'amante liberale. Rinconette, & Cortadiglio. ... Nouamente trasportate dalla lingua castigliana nella nostra italiana da Donato Fontana milanese: .|1627|Italian|Milan|Italy|per bartolomeo vallo alberto besozzo
3983800|La Galatea, dividida en seis libros, compuesta por Miguel de Cervantes Saavedra. Va añadido el Viage del Parnaso del mismo autor|1772|Spanish|Madrid|Spain|la oficina de la viuda de manuel fernández
3991624|L ́ingegnoso Cittadino Don Chisciotte della Mancia. Composto da Michel di Cervantes Saavedra, et hora nuovamente tradotto con fidelta. e peiorezza, di Spagnuolo, in Italiano da Lorenzo Freniosini Fiorentino|1677|Italian|Rome|Italy|gius corvo bart lupardi
3993855|The life and exploits of Don Quixote de la Mancha|1828|English;Spanish|Exeter|England|b williams
3993856|Le Don Quichotte|1822|French|Paris|France|méquignon-marvis libraire-éditeur
3997825|El ingenioso hidalgo don Quixote de la Mancha|1607|Spanish|Brusselas|NA|por roger velpius inpressor de sus altezas l'aguila de oro cerca de palacio
3998046|La tía fingida|1818|Spanish|Berlin|Germany|la libreria de gc nauck
3998047|Les principales avantures de l'admirable Don Quichotte|1746|French|La haie|NA|chés pierre de hondt
3998048|Don Quichotte de la Manche|1798|French|Paris|France|de p didot l'aîné
4033217|Histoire de l'admirable Don Quichotte de la Manche|1786|French|Avignon|France|f sequin
4033566|Historia von Isaac Winckelfelder und Jobst von der Schneid zweyer wunderlicher Gesellen|1624|German|Augspurg|NA|NA
4033573|Don Kichote de la Mantscha, das ist: Juncker Harnisch auss Fleckenland|1669|German|Frankfurt|Germany|götzen
4033575|Vida, y hechos del ingenioso cavallero Don Quixote de la Mancha, parte primera etc. [Texte imprimé|1674|Spanish|Madrid|Spain|NA
4033710|Nouvelles de Michel de Cervantès|1709|French|Amsterdam|Netherlands|c jordan
4033735|Persilus und Sigismunda|1746|German|Ludwigsburg|NA|bey c h pfotenhauern
4033740|Histoire De L'Admirable Don Quichotte De La Manche., VI|1750|French|Frankfurt|Germany|NA
4033743|Moralische Novellen Des Miguel de Cervantes Saavedra, Verfassers des Don Quixotte|1779|German|Leipzig|Germany|dodsley
4033745|Leben und Thaten des weisen Junkers Don Quixote von la Mancha|1780|German|Leipzig|Germany|c frisch
4033749|Die Geschichte des Sancho Pansa, vormahligen Stallmeisters des Don Quixotte [Texte imprimé|1784|German|Leipzig|Germany|NA
4033751|Leben und Thaten des weisen Junkers Don Quixote von Mancha|1785|German|Karlsruhe|Germany|schmieder
4033755|The history and adventures of the renowned Don Quixote [Texte imprimé]., I-IV|1786|English|London|England|NA
4033761|Leiden zweyer edlen Liebenden|1789|German|Heidelberg|Germany|pfähler
4033762|Der sinnreiche Junker Don Quixote von La Mancha|1800|German|Königsberg|NA|nicolovius
4033764|El Ingenioso hidalgo Don Quixote de la Mancha|1804|Spanish|Berlin|Germany|e frölich
4033765|Leben und Thaten des scharfsinnigen Edlen Don Quixote von la Mancha|1810|German|Berlin|Germany|f unger
4033767|La tia fingida|1818|Spanish|Berlin|Germany|c nauck
4033771|El ingenioso hidalgo Don Quixote de la Mancha., Tom. I-VI|1818|Spanish|Leipsique|NA|sommer
4033772|El ingenioso hidalgo Don Quixote de La Mancha., VII, Diccionario español y alemán sobre el Don Quixote de La Mancha|1818|Spanish;German|Leipsique|NA|juan sommer
4033773|Werke von Miguel de Cervantes Saavedra|1825|German|Zwickau|NA|schumann
4033774|Cervantes Sämmtliche Werke|1825|German|Leipzig|Germany|basse
4037466|Leben und Thaten des weisen Junkers Don Quixote von la Mancha [Texte imprimé|1798|German|Vienna|Austria|haas
4037469|Numancia [Texte imprimé|1829|German|Zwickau|NA|NA
4041805|Nouvelles. Traduites de l'espagnol... [par Pierre Hessein.] Rinconet et Cortadille, Le Jaloux d'Estramadure, La Belle Egyptienne. Miguel Cervantes Saavedra|1707|French|Paris|France|p ribou
4048432|Den Verstandigen Vromen Ridder, Don Quichot De La Mancha|1707|Dutch|Amsterdam|Netherlands|graalheekeren
4048437|Tweede Deel Van Den Vromen Verstandigen Ridder, Don Quichot De La Mancha|1707|Dutch|Amsterdam|Netherlands|graalheekeren
4050918|Viage del Parnaso|1614|Spanish|Madrid|Spain|martín
4050919|Nouvelles|1800|French|NA|NA|NA
4050920|Historia de los trabajos de Persiles y Sigismunda|1768|Spanish|Barcelona|Spain|nadal
4056711|Los Trabaios de Persiles y Sigismunda|1617|Spanish|Pamplona|NA|assiayn
4066999|Relatione di quanto e' successo nella città di Vagliadolid, dopò il felicissimo nascimento del principe di Spagna don Filippo Dominico Vittorio nostro sig. fin che si finirono le dimostrazioni d'allegrezza, che per quel si fecero; tradotta di lingua castigliana da Cesare Parona, ad instanza di Girolamo Bordoni|1608|Italian|Milan|Italy|per girolamo bordoni pietro martire locarni
4070697|El ingenioso hidalgo don Quixote de la Mancha compuesto por Miguel de Cervántes saavedra|1782|Spanish|Madrid|Spain|por don joachin ibarraimpresor de camara de s m y de la real academia
4075742|L'ingegnoso cittadino Don Chisciotte della Mancia. Composto da Michel di Cruantes Saauedra. Et hora nuouamente tradotto con fedelta, e chiarezza, di spagnuolo, in italiano. Da Lorenzo Franciosini fiorentino. Opera gustosissima, e di grandissimo trattenimento ... Con vna tauola ordinatissima .|1622|Italian|Venice|Italy|appresso andrea baba
4078597|Vida, y hechos del ingenioso cavallero don Quixote de la Mancha. Compuesta por Miguel de Cervantes Saavedra. Parte primera -2.!|1714|Spanish|Madrid|Spain|costa de francisco laso mercader de libros
4084544|Histoire de l'admirable don Quichotte de la Manche, traduite de l'Espagnol de Michel de Cervantes ... Tome premier (-sixieme|1781|French|Lyon|France|chez amable le roy quai de villeroi
4085527|Don Quichottes råd til Sancho Pancha, då han for at emottaga styrelsen öfwer öen Barataria. =Anon=. Stockholm tryckt hos A.J. Nordström. 1784|1784|Swedish|Stockholm|Sweden|nordström
4090654|Den sindrige Herremands Don Quixote af Mancha Levnet og Bedrifter : Oversat, efter det i Amsterdam og Leipzig 1755, udgivne Spanske Oplag, af Charlotta Dorothea Biehl. 1.-4. Tome. [Med Kobberstik, hvoriblandt Forfatterens Portrait.] (tr. hos Hallager|1776|Danish|Kbh|NA|NA
4092502|Nouelas exemplares|1617|Spanish|Lisbon|Portugal|por antonio aluarez
4092503|Los trabaios de Persiles y Sigismunda|1617|Spanish|Lisbon|Portugal|por iorge rodriguez
4092504|El ingenioso hidalgo don Quixote de la Mancha|1605|Spanish|Con privilegio madrid|NA|por iuan de la cuesta vendese casa de francisco de robles librero del rey nro señor
4092752|Novelas exemplares.|1783|Spanish|Valencia|Spain|por salvador faulí
4092753|Historia de los trabajos de Persiles y Segismunda|1734|Spanish|Barcelona|Spain|pablo campins
4092754|El ingenioso hidalgo Don Quixote de la Mancha.|1810|Spanish|Leon|NA|casa de tournachon-molin
4092755|Histoire de l'admirable Don Quichotte de la Manche.|1769|French|Paris|France|chez david l'ainé
4092756|Histoire de l'admirable Don Quichotte de la Manche.|1786|French|Avignon|France|françois seguin imprimeur-libraire
4115311|The History of the ingenious gentleman Don Quixote of la Mancha... Vol. I [Texte imprimé|1822|English|Edinburgh|Scotland|NA
4116952|Obras escogidas... [Texte imprimé|1826|Spanish|Paris|France|NA
4141365|Novelas Ejemplares [Texte imprimé|1825|Spanish|Paris|France|libr de cormón y blanc
4158207|Persile Et Sigismonde|1740|French|Amsterdam|Netherlands|changuion
4158208|Persile Et Sigismonde|1740|French|Amsterdam|Netherlands|changuion
4158254|Persile Et Sigismonde|1740|French|Amsterdam|Netherlands|changuion
4158255|Persile Et Sigismonde|1740|French|Amsterdam|Netherlands|changuion
4158287|Lærerige Fortællinger|1780|Danish|Copenhagen|Denmark|møller
4158295|Lærerige Fortællinger|1781|Danish|Copenhagen|Denmark|møller
4160412|Histoire De L'Admirable Don Quichotte De La Manche|1771|French|Paris|France|compagnie des libraires
4160416|Histoire De L'Admirable Don Quichotte De La Manche|1771|French|Paris|France|compagnie des libraires
4160418|Histoire De L'Admirable Don Quichotte De La Manche|1771|French|Paris|France|compagnie des libraires
4160419|Histoire De L'Admirable Don Quichotte De La Manche|1771|French|Paris|France|compagnie des libraires
4160436|Histoire De L'Admirable Don Quichotte De La Manche|1771|French|Paris|France|compagnie des libraires
4160438|Histoire De L'Admirable Don Quichotte De La Manche|1771|French|Paris|France|compagnie des librairesle breton
4160568|Vida Y Hechos Del Ingenioso Hidalgo Don Quixote De La Mancha|1738|Spanish|London|England|tonson
4160572|Vida Y Hechos Del Ingenioso Hidalgo Don Quixote De La Mancha|1738|Spanish|London|England|tonson
4160578|Vida Y Hechos Del Ingenioso Hidalgo Don Quixote De La Mancha|1738|Spanish|London|England|tonson
4160580|Vida Y Hechos Del Ingenioso Hidalgo Don Quixote De La Mancha|1738|Spanish|London|England|tonson
4162596|The Life And Exploits Of Don Quixote De la Mancha|1821|English|Liverpool london|NA|reillybumpussammssharpewarrenwilson
4162597|The Life And Exploits Of Don Quixote De la Mancha|1821|English|Liverpool london|NA|reillybumpussammssharpewarrenwilson
4162607|The Life And Exploits Of Don Quixote De la Mancha|1821|English|Liverpool london|NA|reillybumpussammssharpewarrenwilson
4162610|The Life And Exploits Of Don Quixote De la Mancha|1821|English|Liverpool london|NA|reillybumpussammssharpewarrenwilson
4162880|The History And Adventures Of the Renowned Don Quixote|1809|English|London|England|faulderjohnsonrichardsonrivingtonvernor hood sharpewalkerlewis
4162881|The History And Adventures Of the Renowned Don Quixote|1809|English|London|England|faulderjohnsonrichardsonrivingtonvernor hood sharpewalkerlewis
4171041|Don Quichotte de la Manche, traduit de l'espagnol de Michel de Cervantes par Florian; ouvrage posthume|1802|French|Paris|France|de l'imprim de guilleminet
4173068|Istoria settentrionale, de trauagli di Persile, e Sigismonda. Diuisa in quattro libri. Di Michele di Ceruantes Saauedra, nella quale senza interrompere il filo dell'istoria si leggono molti casi d'amore e di fortuna; ... Di nuouo dalla lingua castigliana nella nostra italiana tradotta, dal signor Francesco Ellio milanese|1626|Italian|Venice|Italy|per bartolomeo fontana
4180368|Vida y hechos del ingenioso hidalgo don Quixote de la Mancha|1738|Spanish|London|England|por y r tonson
4181011|El ingenioso hidalgo Don Quixote de la Mancha compuesto por Miguel De Cervantes Saavedra parte primera [-segunda|1800|Spanish|Leipsique|NA|por juan sommer
4183139|El ingenioso hidalgo Don Quixote de la Mancha compuesto por Miguel de Cervantes Saavedra ... Parte primera [-segunda]. Tomo 1 [-4|1780|Spanish|Madrid|Spain|por don joaquin ibarra impresor de camara de sm y de la real academia
4184031|O velho e a menina, ou o casamento desigual. Novella hespanhola do insigne Miguel de Cervantes Saavedra traduzida em vulgar|1818|Portuguese|Lisbon|Portugal|na nova impres da viuva neves e filhos
4186955|Viage del Parnaso|1614|Spanish|Madrid|Spain|por la viuda de alonso martin
4186956|Vida y hechos del ingenioso cavallero don Quixote de la Mancha|1662|Spanish|Bruselas|NA|de la emprenta de juan mommarte impresor jurado
4187206|Obras escogidas.|1829|Spanish|Madrid|Spain|hijos de catalina piñuela
4187207|Trabajos de Persiles y Sigismunda|1781|Spanish|Madrid|Spain|antonio de sancha
4187209|El ingenioso hidalgo don Quixote de la Mancha|1797|Spanish|Madrid|Spain|la imprenta real
4187211|Histoire de l'admirable Don Quichotte de la Manche|1711|French|Lyon|France|thomas amaulry
4187212|Histoire de l'admirable Don Quichotte de la Manche|1798|French|Paris|France|chez fr dufart
4187213|Don Quichotte de la Manche|1809|French|London|England|chez didiez tebbett
4188634|Don Quixote von Mancha, Abentheurliche geschichte|1682|German;deu|Basel|Switzerland|verlegt von johann ludwig du four von genff
4191616|Don Quichotte de la Manche|1799|French|Paris|France|NA
4191617|Den verstandigen vroomen Ridder, Don Zuichot de la Mancha, en onse Nederl. tale overgeset door L. V. B. [i.e.: Lambert v. d. Bosch|1670|English|Dordrecht|Netherlands|NA
4197149|Novelas exemplares de Miguèl de Cervantes Saavedra|1739|Spanish|Haya|NA|neaulme
4197229|Histoire de l'admirable Don Quichotte de la Manche|1825|French|Paris|France|delongchamps libraire-éditeur
4201509|Nouelas exemplares|1664|Spanish|Seuilla|NA|por iuan gomez de blas
4201661|Obras escogidas de Miguel de Cervantes Saavedra|1829|Spanish|Madrid|Spain|NA
4201777|Obras escogidas|1826|Spanish|Paris|France|bossange
4201778|Novelas exemplares.|1743|Spanish|Amberes|NA|costa de bousques y compañía
4201779|Vida, y hechos del ingenioso cavallero Don Quixote de la Mancha|1714|Spanish|Madrid|Spain|costa de francisco laso
4201781|El Ingenioso Hidalgo D. Quijote de la Mancha.|1829|Spanish|Madrid|Spain|hijos de catalina piñuela
4201782|Histoire de l'admirable Don Quichotte de la Manche.|1722|French|Paris|France|por la compagnie des libraires
4201783|Don Quichotte de la Manche|1809|French|London|England|c spilsbury etc
4201784|Don Quichotte de la Manche|1820|French|Paris|France|chez ant aug renouard
4201785|A literal translation, with the Spanish interlined of the life and exploits of the Ingenious Knight Don Quixote de la Mancha|1816|English|London|England|ds maurice
4201786|The life and exploits of Don Quixote de la Mancha|1821|English|London|England|w wilson bumpus etc
4203997|Don Qvixote von Mancha|1683|German|Basel franckfurt|NA|jl du four
4204919|Histoire de l'admirable Don Quichotte de la Manche|1768|NA|Paris|France|par la compagnie des libraires
4204935|Nouvelles De Michel De Cervantes, Auteur de l'Histoire De Don Quichotte|1720|French|Amsterdam|Netherlands|lucas
4207539|Pt. 2 =|1787|NA|Madrid|Spain|ibarra
4207710|El ingenioso hidalgo Don Quixote de la Mancha|1797|Spanish|Madrid|Spain|de sancha
4209818|Histoire de l'admirable Don Quichotte de la Manche|1741|NA|Paris|France|clousier ua
4210898|Histoire de l'admirable Don Quichotte de la Manche|1741|NA|Paris|France|clousier ua
4211293|Histoire de l'admirabile Don Quichotte de La Manche|1782|French|Liège|Belgium|bassompierre
4211294|Don Quichotte De La Manche|1799|French|Paris|France|detervilledidot l'aîné
4215044|Leben und Thaten des weisen Junkers Don Quixote von Mancha|1785|German|Karlsruhe|Germany|schmieder
4218835|Leben und Thaten des sinnreichen Junkers Don Quijote von der Mancha|1825|German|Zwickau|NA|schumann
4223596|Histoire de l'admirable Don Quichotte de la Manche|1722|NA|Paris|France|NA
4223769|Des berühmten Ritters Don Quixote von Mancha, Lustige und sinnreiche Geschichte / abgefasset von Miguel Cervanntes Saavedra|1753|German|Leipzig|Germany|fritsch
4253828|The entertaining history of that famous knight, Don Quixote de la Mancha|1776|English|London|England|h turpin no st john's-street west smithfield s bladon no bew no pater-noster-row
4253854|The life and exploits of the ingenious gentleman Don Quixote, de la Mancha|1778|English|London|England|f newbery corner st paul's church-yard
4253865|The much-esteemed history of the ever-famous knight Don Quixote de la Mancha|1605|English|London|England|h woodgate s brooks golden- ball pater-noster-row
4258383|The life and exploits of the ingenious gentleman Don Quixote de la Mancha|1825|English|New York NY|USA|e duyckinck
